{
  "schema": "provider-free.source-inventory@1",
  "source_inventory_id": "source-inventory:sha256:bbbbbbbbbbbbbbbbbbbbbbbbbbbbbbbbbbbbbbbbbbbbbbbbbbbbbbbbbbbbbbbb",
  "admitted_sources": [
    {
      "source_id": "source:sha256:cccccccccccccccccccccccccccccccccccccccccccccccccccccccccccccccc",
      "path": "src/lib.rs",
      "range": {"start_line": 1, "end_line": 1},
      "payload_id": "source-payload:sha256:dddddddddddddddddddddddddddddddddddddddddddddddddddddddddddddddd",
      "bytes": 10,
      "sha256": "sha256:eeeeeeeeeeeeeeeeeeeeeeeeeeeeeeeeeeeeeeeeeeeeeeeeeeeeeeeeeeeeeeee"
    }
  ],
  "canonical_sha256": "sha256:ffffffffffffffffffffffffffffffffffffffffffffffffffffffffffffffff"
}
